{
  "event_id": "ev-1",
  "stream_id": "run-1",
  "sequence": 42,
  "occurred_at": "2026-10-11T05:00:00Z",
  "recorded_at": "2026-10-11T05:00:00Z",
  "type": "run.placement_hint",
  "schema_version": "0.1.0",
  "project_id": "prj-demo",
  "operation_id": "op-1",
  "run_id": "run-1",
  "attempt_id": null,
  "payload": {
    "anything": 1
  },
  "evidence_refs": []
}
